{
  "$schema": "https://json-schema.org/draft/2020-12/schema",
  "$id": "https://hawkinsoperations.example/schemas/artifact-manifest-v1.schema.json",
  "title": "Hoxline Artifact Manifest v1",
  "type": "object",
  "additionalProperties": false,
  "required": [
    "manifest_version",
    "artifact_id",
    "artifact_name",
    "artifact_type",
    "artifact_family",
    "source_owner",
    "validation_owner",
    "platform_owner",
    "proof_owner",
    "product_owner",
    "telemetry_contract",
    "fixture_paths",
    "expected_event_ids",
    "expected_rule_ids",
    "allowed_claim_class",
    "requested_claims",
    "blocked_claim_classes",
    "public_safe_status",
    "human_review_required",
    "ai_disposition_authority",
    "proof_boundary",
    "runtime_boundary",
    "signal_boundary",
    "next_gate"
  ],
  "properties": {
    "manifest_version": { "const": "artifact-manifest-v1" },
    "artifact_id": {
      "type": "string",
      "pattern": "^(?:HO-DET|HO-NDR|ID-DET|AWS-DET)-[0-9]{3}$"
    },
    "artifact_name": { "type": "string", "minLength": 1 },
    "artifact_type": { "const": "detection-review-artifact" },
    "artifact_family": { "const": "synthetic-review-only" },
    "source_owner": { "const": "hawkinsoperations-detections" },
    "validation_owner": { "const": "hawkinsoperations-validation" },
    "platform_owner": { "const": "hawkinsoperations-platform" },
    "proof_owner": { "const": "hawkinsoperations-proof" },
    "product_owner": { "const": "hoxline" },
    "telemetry_contract": {
      "type": "object",
      "additionalProperties": false,
      "required": ["source", "event_ids", "wazuh_rule_ids", "required_fields", "scope"],
      "properties": {
        "source": { "type": "string", "minLength": 1 },
        "event_ids": {
          "type": "array",
          "uniqueItems": true,
          "items": { "type": "integer", "minimum": 0 }
        },
        "event_keys": {
          "type": "array",
          "uniqueItems": true,
          "items": { "type": "string", "minLength": 1 }
        },
        "event_key_field": { "type": "string", "minLength": 1 },
        "wazuh_rule_ids": {
          "type": "array",
          "uniqueItems": true,
          "items": { "type": "integer", "minimum": 0 }
        },
        "required_fields": {
          "type": "array",
          "minItems": 1,
          "uniqueItems": true,
          "items": { "type": "string", "minLength": 1 }
        },
        "scope": { "type": "string", "minLength": 1 },
        "source_control_note": { "type": "string", "minLength": 1 }
      }
    },
    "fixture_paths": {
      "type": "object",
      "additionalProperties": false,
      "required": ["positive", "negative"],
      "properties": {
        "positive": { "type": "string", "pattern": "^examples/" },
        "negative": { "type": "string", "pattern": "^examples/" }
      }
    },
    "expected_event_ids": {
      "type": "array",
      "uniqueItems": true,
      "items": { "type": "integer", "minimum": 0 }
    },
    "expected_event_keys": {
      "type": "array",
      "uniqueItems": true,
      "items": { "type": "string", "minLength": 1 }
    },
    "expected_rule_ids": {
      "type": "array",
      "uniqueItems": true,
      "items": { "type": "integer", "minimum": 0 }
    },
    "allowed_claim_class": { "type": "string", "minLength": 1 },
    "requested_claims": {
      "type": "array",
      "items": { "type": "string", "minLength": 1 }
    },
    "blocked_claim_classes": {
      "type": "array",
      "minItems": 1,
      "uniqueItems": true,
      "items": { "type": "string", "minLength": 1 }
    },
    "public_safe_status": { "const": "NOT_PUBLIC_SAFE" },
    "human_review_required": { "const": true },
    "ai_disposition_authority": { "const": false },
    "endpoint_mutation": { "const": false },
    "wazuh_mutation": { "const": false },
    "runtime_proof": { "const": false },
    "public_proof_promoted": { "const": false },
    "lifetime_ledger_changed": { "const": false },
    "proof_boundary": { "type": "string", "minLength": 1 },
    "runtime_boundary": { "type": "string", "minLength": 1 },
    "signal_boundary": { "type": "string", "minLength": 1 },
    "next_gate": { "type": "string", "minLength": 1 },
    "expected_review_outcome": { "const": "BLOCKED" },
    "expected_block_reason": { "type": "string", "minLength": 1 },
    "additional_telemetry_sources": {
      "type": "array",
      "items": { "type": "string", "minLength": 1 }
    },
    "attack_mapping": { "type": "object" },
    "confidence": { "type": "string" },
    "detection_family": { "type": "string" },
    "field_mapping": {
      "type": "object",
      "additionalProperties": { "type": "string" }
    },
    "severity": { "type": "string" },
    "triage_what_happened": { "type": "string" },
    "triage_why_it_matters": { "type": "string" }
  }
}
