{
  "ai_disposition_authority": false,
  "allowed_claim_class": "controlled local fixture review only",
  "artifact_family": "synthetic-review-only",
  "artifact_id": "ID-DET-002",
  "artifact_name": "Identity authentication control fixture review",
  "artifact_type": "detection-review-artifact",
  "blocked_claim_classes": [
    "production ready",
    "public-safe runtime proof",
    "SOCaaS deployed",
    "customer deployed",
    "autonomous SOC",
    "AI-approved disposition",
    "analyst-approved disposition",
    "final authorization",
    "case closure",
    "website rendering as proof",
    "green CI as approval"
  ],
  "confidence": "bounded-fixture-only",
  "detection_family": "id-det-002",
  "endpoint_mutation": false,
  "expected_event_ids": [],
  "expected_event_keys": [
    "risky_authentication_change"
  ],
  "expected_rule_ids": [],
  "field_mapping": {
    "event_key": "fixture selector",
    "channel": "fixture source label",
    "action": "bounded fixture action",
    "actor": "synthetic actor label"
  },
  "fixture_paths": {
    "negative": "examples/review/fixtures/id-det-002-safe-negative-fixture.json",
    "positive": "examples/review/fixtures/id-det-002-safe-fixture.json"
  },
  "human_review_required": true,
  "lifetime_ledger_changed": false,
  "manifest_version": "artifact-manifest-v1",
  "next_gate": "human_review_gate",
  "platform_owner": "hawkinsoperations-platform",
  "product_owner": "hoxline",
  "proof_boundary": "Fixture-only local review output; not public proof and not proof authority.",
  "proof_owner": "hawkinsoperations-proof",
  "public_proof_promoted": false,
  "public_safe_status": "NOT_PUBLIC_SAFE",
  "requested_claims": [
    "ID-DET-002 can be reviewed locally through deterministic Hoxline Review Engine v1 using bundled synthetic fixtures only."
  ],
  "runtime_boundary": "No runtime execution, endpoint mutation, VM, Wazuh, Splunk, Cribl, private infrastructure, or live signal action.",
  "runtime_proof": false,
  "severity": "medium",
  "signal_boundary": "Synthetic fixture signal only; not public signal observation.",
  "source_owner": "hawkinsoperations-detections",
  "telemetry_contract": {
    "event_ids": [],
    "event_keys": [
      "risky_authentication_change"
    ],
    "event_key_field": "event_key",
    "required_fields": [
      "event_key",
      "channel",
      "action",
      "actor"
    ],
    "scope": "fixture-only metadata contract",
    "source": "Identity controlled fixture metadata",
    "source_control_note": "Source and controlled-validation metadata remain owned by their repositories; this manifest carries sanitized fixture metadata only.",
    "wazuh_rule_ids": []
  },
  "triage_what_happened": "A synthetic fixture represented the ID-DET-002 controlled review pattern.",
  "triage_why_it_matters": "The bounded pattern is useful for deterministic reviewer reproduction when kept separate from runtime and proof claims.",
  "validation_owner": "hawkinsoperations-validation",
  "wazuh_mutation": false
}
